{
  "$schema": "./mapping-schema.json",
  "workItemType": "Epic",
  "referenceName": "Microsoft.VSTS.WorkItemTypes.Epic",
  "description": "A large body of work that can be broken down into smaller units of work. Relates to business objective or a major investment",
  "color": "FF7B00",
  "icon": "icon_crown",
  "boltArtifact": "None - Epics are not directly managed in BOLT but can be used for high-level tracking in Azure DevOps",
  "mappings": {
    "core": {
      "System.Title": {
        "boltSource": null,
        "description": "Epic title",
        "required": true,
        "transformation": null
      },
      "System.Description": {
        "boltSource": null,
        "description": "Epic description",
        "required": false,
        "transformation": "html"
      },
      "System.State": {
        "boltSource": null,
        "description": "Epic state",
        "required": true,
        "allowedValues": ["New", "Active", "Resolved", "Closed"],
        "defaultValue": "New"
      },
      "System.AssignedTo": {
        "boltSource": null,
        "description": "Assigned to",
        "required": false
      }
    },
    "planning": {
      "Microsoft.VSTS.Scheduling.StartDate": {
        "boltSource": null,
        "description": "Start date",
        "required": false,
        "type": "datetime"
      },
      "Microsoft.VSTS.Scheduling.TargetDate": {
        "boltSource": null,
        "description": "Target date",
        "required": false,
        "type": "datetime"
      },
      "Microsoft.VSTS.Common.Priority": {
        "boltSource": null,
        "description": "Priority",
        "required": false,
        "allowedValues": [1, 2, 3, 4],
        "defaultValue": 2
      },
      "Microsoft.VSTS.Scheduling.Effort": {
        "boltSource": null,
        "description": "Effort estimate",
        "required": false,
        "type": "double"
      }
    },
    "business": {
      "Microsoft.VSTS.Common.BusinessValue": {
        "boltSource": null,
        "description": "Business value",
        "required": false,
        "type": "integer"
      },
      "Microsoft.VSTS.Common.TimeCriticality": {
        "boltSource": null,
        "description": "Time criticality",
        "required": false,
        "type": "double"
      },
      "Microsoft.VSTS.Common.ValueArea": {
        "boltSource": null,
        "description": "Value area",
        "required": false,
        "allowedValues": ["Business", "Architectural"],
        "defaultValue": "Business"
      }
    },
    "criteria": {
      "Microsoft.VSTS.Common.AcceptanceCriteria": {
        "boltSource": null,
        "description": "Acceptance criteria",
        "required": false,
        "transformation": "html"
      }
    },
    "classification": {
      "System.AreaPath": {
        "boltSource": null,
        "description": "Area path",
        "required": true,
        "transformation": "path"
      },
      "System.IterationPath": {
        "boltSource": null,
        "description": "Iteration path",
        "required": false,
        "transformation": "path"
      },
      "System.Tags": {
        "boltSource": null,
        "description": "Tags",
        "required": false,
        "transformation": "semicolon-separated",
        "defaultValue": "Bolt Framework"
      }
    }
  },
  "notes": [
    "Epics are typically not created from BOLT specs directly",
    "Epics represent higher-level business objectives that span multiple features",
    "For BOLT methodology, Features in Azure DevOps map to BOLT feature specs"
  ]
}
